Question ID,Assessment Key,Module ID,Module Name,Question,Choice A,Choice B,Choice C,Choice D,Choice E,Points A,Points B,Points C,Points D,Points E
172,CPT,17,Intrapersonal,My ability to understand my own emotions helps me to decide whether or how to be involved in certain situations.,Never,Rarely,Sometimes,Often,Always,1,2,3,4,5
173,CPT,17,Intrapersonal,I understand why I believe and behave the way I do.,Never,Rarely,Sometimes,Often,Always,1,2,3,4,5
174,CPT,17,Intrapersonal,I often spend ‘quiet time’ reflecting on the important issues in my life.,Never,Rarely,Sometimes,Often,Always,1,2,3,4,5
175,CPT,17,Intrapersonal,I am an independent thinker—I know my own mind.,Never,Rarely,Sometimes,Often,Always,1,2,3,4,5
176,CPT,17,Intrapersonal,I have a private hobby or interest which I don’t really share with anyone else.,Never,Rarely,Sometimes,Often,Always,1,2,3,4,5
177,CPT,17,Intrapersonal,I work for myself—or have seriously contemplated ‘doing your own thing.’,Never,Rarely,Sometimes,Often,Always,1,2,3,4,5
178,CPT,17,Intrapersonal,I have specific goals in life that I think about regularly.,Never,Rarely,Sometimes,Often,Always,1,2,3,4,5
179,CPT,17,Intrapersonal,I would rather spend a weekend in a cabin or hide-away than at a large resort with lots of people.,Never,Rarely,Sometimes,Often,Always,1,2,3,4,5
180,CPT,17,Intrapersonal,I like to be involved in causes that help others.,Never,Rarely,Sometimes,Often,Always,1,2,3,4,5
181,CPT,17,Intrapersonal,I am keenly aware of my moral beliefs.,Never,Rarely,Sometimes,Often,Always,1,2,3,4,5
182,CPT,17,Intrapersonal,I learn best when I have an emotional attachment to the subject.,Never,Rarely,Sometimes,Often,Always,1,2,3,4,5
183,CPT,17,Intrapersonal,Fairness is important to me.,Never,Rarely,Sometimes,Often,Always,1,2,3,4,5
184,CPT,18,Naturalist,I am conscious of wildlife while on a walk and can ‘read’ weather signs.,Never,Rarely,Sometimes,Often,Always,1,2,3,4,5
185,CPT,18,Naturalist,I am a keen gardener.,Never,Rarely,Sometimes,Often,Always,1,2,3,4,5
186,CPT,18,Naturalist,I consider that conservation of resources and achieving sustainable growth are two of the biggest issues of our times.,Never,Rarely,Sometimes,Often,Always,1,2,3,4,5
187,CPT,18,Naturalist,I enjoy categorizing things by common traits,Never,Rarely,Sometimes,Often,Always,1,2,3,4,5
188,CPT,18,Naturalist,Classification helps me make sense of new data. ,Never,Rarely,Sometimes,Often,Always,1,2,3,4,5
189,CPT,18,Naturalist,I enjoy working in a garden.,Never,Rarely,Sometimes,Often,Always,1,2,3,4,5
190,CPT,18,Naturalist,Putting things in hierarchies makes sense to me,Never,Rarely,Sometimes,Often,Always,1,2,3,4,5
191,CPT,18,Naturalist,I am good at categorizing and cataloguing information easily ,Never,Rarely,Sometimes,Often,Always,1,2,3,4,5
192,CPT,18,Naturalist,I enjoy keeping pets ,Never,Rarely,Sometimes,Often,Always,1,2,3,4,5
193,CPT,18,Naturalist,I like to learn about nature ,Never,Rarely,Sometimes,Often,Always,1,2,3,4,5
194,CPT,18,Naturalist,"I like to camp, hike, walk and climb .",Never,Rarely,Sometimes,Often,Always,1,2,3,4,5
195,CPT,18,Naturalist,I am conscious of changes in the weather.,Never,Rarely,Sometimes,Often,Always,1,2,3,4,5
196,CPT,18,Naturalist,I enjoy nature and to be outdoors. ,Never,Rarely,Sometimes,Often,Always,1,2,3,4,5